{
  "inviteId": "550e8400-e29b-41d4-a716-446655440100",
  "familySpaceId": "550e8400-e29b-41d4-a716-446655440000",
  "inviteToken": "550e8400-e29b-41d4-a716-446655440100.AAAAAAAAAAAAAAAAAAAAAAAAAAAAAAAAAAAAAAAAAAA",
  "role": "member",
  "expiresAt": "2026-08-02T12:44:56.000Z",
  "createdByDeviceId": "11111111-2222-4333-8444-555555555555"
}
